{
  "name": "Per-VU Iterations Template",
  "environment": "dev",
  "execution_mode": "parallel",
  "global_load_profile": {
    "executor": "per-vu-iterations",
    "vus": 10,
    "iterations": 20
  },
  "user_journeys": [
    {
      "name": "example_journey",
      "scriptPath": "example-journey.js",
      "weight": 100
    }
  ],
  "global_sla": {
    "p95": 3000,
    "errorRate": 5
  }
}
