{
  "$schema": "../schemas/test-plan.schema.json",
  "name": "WebUI Load Test - jpet",
  "environment": "dev",
  "execution_mode": "parallel",
  "global_load_profile": {
    "executor": "ramping-vus",
    "startVUs": 0,
    "stages": [
      {
        "duration": "5s",
        "target": 5
      },
      {
        "duration": "30s",
        "target": 5
      },
       {
        "duration": "30s",
        "target": 10
      },
          {
        "duration": "30s",
        "target": 15
      },
      {
        "duration": "30s",
        "target": 0
      }
    ]
  },
  "noCookiesReset": true,
  "user_journeys": [
    {
      "name": "buyanimal_raw_20thmay",
      "scriptPath": "buyanimal_raw_20thmay.js",
      "weight": 100
    }
  ],
  "global_sla": {
    "p99": 2000,
    "errorRate": 10
  },
  "journey_slas": {
    "buy_animal_14thmay": {
      "p95": 1500,
      "errorRate": 5
    }
  },
  "transaction_slas": {
    "t01_launch": {
      "p95": 800
    },
    "t02_login": {
      "p95": 1000
    },
    "click_confirm": {
      "p95": 1500,
      "p99": 3000
    }
  }
}