{
  "name": "WebUI Load Test - test.k6.io",
  "environment": "dev",
  "execution_mode": "parallel",
  "global_load_profile": {
    "executor": "ramping-vus",
    "startVUs": 0,
    "stages": [
      { "duration": "15s", "target": 10 },
      { "duration": "1m",  "target": 10 },
      { "duration": "15s", "target": 0  }
    ]
  },
  "user_journeys": [
    {
      "name": "buyanimal_1_framework_lifecycle",
      "scriptPath": "buyanimal_1_framework_lifecycle.js",
      "weight": 100
    }
  ],
  "global_sla": {
    "p95": 2000,
    "errorRate": 10
  }
}
