{
  "name": "Constant VUs Template",
  "environment": "dev",
  "execution_mode": "parallel",
  "global_load_profile": {
    "executor": "constant-vus",
    "vus": 20,
    "duration": "10m"
  },
  "user_journeys": [
    {
      "name": "example_journey",
      "scriptPath": "example-journey.js",
      "weight": 100
    }
  ],
  "global_sla": {
    "p95": 3000,
    "errorRate": 5
  }
}
