{
  "name": "Ramping VUs Template",
  "environment": "dev",
  "execution_mode": "parallel",
  "global_load_profile": {
    "executor": "ramping-vus",
    "startVUs": 0,
    "stages": [
      { "duration": "2m", "target": 50 },
      { "duration": "5m", "target": 50 },
      { "duration": "2m", "target": 0 }
    ]
  },
  "user_journeys": [
    {
      "name": "example_journey",
      "scriptPath": "example-journey.js",
      "weight": 100
    }
  ],
  "global_sla": {
    "p95": 3000,
    "errorRate": 5
  }
}
